{
  "$schema": "https://json-schema.org/draft/2020-12/schema",
  "$id": "https://github.com/Smithbox-ai/ControlFlowCodex/schemas/revision-request.schema.json",
  "type": "object",
  "additionalProperties": false,
  "required": [
    "schema_version",
    "plan_path",
    "source_verdict_path",
    "source_verdict_status",
    "failure_classification",
    "next_action",
    "summary",
    "items"
  ],
  "properties": {
    "schema_version": { "const": "1.0.0" },
    "plan_path": { "type": "string", "pattern": "^plans/.+-plan\\.md$" },
    "source_verdict_path": { "type": "string", "pattern": "^plans/artifacts/.+/verify-verdict\\.md$" },
    "source_verdict_status": { "enum": ["NEEDS_REVISION", "REJECTED"] },
    "failure_classification": { "enum": ["fixable", "needs_replan", "escalate"] },
    "next_action": { "enum": ["revise", "replan", "escalate"] },
    "summary": { "type": "string", "minLength": 1 },
    "items": { "type": "array", "minItems": 1, "items": { "$ref": "#/$defs/item" } }
  },
  "$defs": {
    "item": {
      "type": "object",
      "additionalProperties": false,
      "required": ["id", "location", "finding", "required_change", "acceptance_criteria"],
      "properties": {
        "id": { "type": "string", "minLength": 1 },
        "location": { "type": "string", "minLength": 1 },
        "finding": { "type": "string", "minLength": 1 },
        "required_change": { "type": "string", "minLength": 1 },
        "acceptance_criteria": { "type": "string", "minLength": 1 }
      }
    }
  }
}
