{
  "schema_version": "1.0.0",
  "plan_path": "plans/revision-loop-plan.md",
  "source_verdict_path": "plans/artifacts/revision-loop/verify-verdict.md",
  "source_verdict_status": "NEEDS_REVISION",
  "failure_classification": "fixable",
  "next_action": "revise",
  "summary": "Add the missing focused acceptance assertion before the next verification run.",
  "items": [
    {
      "id": "focused-acceptance-assertion",
      "location": "tests/revision-request.tests.ps1",
      "finding": "The focused acceptance assertion is missing.",
      "required_change": "Add the focused acceptance assertion for the bounded revision.",
      "acceptance_criteria": "The focused revision contract test verifies the requested assertion."
    }
  ]
}
